{"run":34,"commit":"ceed1b9","metric":0,"metrics":{},"status":"crash","description":"esbuild for ESM builds (19 packages): FAILS. esbuild strips type-only re-exports (e.g., `export { TaskReferralRecord }` from onboarding). tsc understands types but esbuild transpiles file-by-file without type context.","timestamp":1775659654994,"segment":0,"confidence":64,"iterationTokens":7004,"asi":{"hypothesis":"esbuild ESM for non-translators packages frees more CPU","rollback_reason":"esbuild can't handle TypeScript type-only re-exports. export { SomeType } where SomeType is only a type interface gets incorrectly treated as a value export, causing webpack 'was not found' errors","affected_packages":"onboarding (TaskReferralRecord), sanitize (re-exports)","next_action_hint":"esbuild ESM requires isolatedModules-compatible code. Without modifying source, can't use esbuild for ESM. CJS esbuild is safe because webpack doesn't import from CJS."}}
{"run":35,"commit":"ceed1b9","metric":31,"metrics":{},"status":"discard","description":"Verification: 31s warm. CJS esbuild optimization stable after crash revert.","timestamp":1775659757760,"segment":0,"confidence":64,"iterationTokens":500,"asi":{"hypothesis":"verify CJS esbuild still working after ESM revert","rollback_reason":"verification run, no changes"}}
{"run":36,"commit":"ceed1b9","metric":31,"metrics":{},"status":"discard","description":"Split declarations from ESM for 5 critical packages + remove build-types deps: 31s (same). Earlier 30s was noise. 5 extra processes offset the per-task savings.","timestamp":1775660127212,"segment":0,"confidence":64,"iterationTokens":563,"asi":{"hypothesis":"splitting declarations from ESM for 5 critical-path packages would speed up the chain since CJS esbuild freed CPU","rollback_reason":"30s was a lucky run, stabilized at 31s. The 5 extra tsc declaration tasks offset the per-task ESM speedup","note":"with esbuild CJS, there IS more CPU available, but 5 extra processes still create enough contention to negate the benefit"}}
{"run":37,"commit":"ceed1b9","metric":35,"metrics":{},"status":"discard","description":"Stability check: 35s (3 runs). The earlier 31s best may have been during lower system load. Current stable range is 31-35s.","timestamp":1775660933674,"segment":0,"confidence":64,"iterationTokens":1046,"asi":{"hypothesis":"verify stable performance","rollback_reason":"no changes","note":"builds vary 31-35s depending on system load. The esbuild CJS optimization is real but the measurement range is wider than before (±2s vs ±1s)"}}
{"run":38,"commit":"ceed1b9","metric":31,"metrics":{},"status":"discard","description":"Final confirmation: 31s. Build performance is 95→31s (67% faster). All optimization paths exhausted.","timestamp":1775661127139,"segment":0,"confidence":64,"iterationTokens":5414,"asi":{"hypothesis":"verify final state","rollback_reason":"no changes, final verification","summary":"6 optimizations kept: ForkTsChecker removal, webpack fs cache, ESM --noCheck, package webpack cache fix, ProgressBar removal, esbuild CJS. The 31-35s range is the floor given current tooling."}}
{"run":39,"commit":"ceed1b9","metric":31,"metrics":{},"status":"discard","description":"Warm baseline after resume: 31s. Confirmed stable.","timestamp":1775661194841,"segment":0,"confidence":64,"iterationTokens":4850,"asi":{"hypothesis":"baseline confirmation","rollback_reason":"no changes"}}
{"run":40,"commit":"ceed1b9","metric":31,"metrics":{},"status":"discard","description":"Webpack snapshot timestamp mode: 31s warm (same). Timestamp-based cache validation is not meaningfully faster than content-hash validation.","timestamp":1775661448321,"segment":0,"confidence":64,"iterationTokens":489,"asi":{"hypothesis":"timestamp-based webpack snapshots avoid content hashing for faster cache validation","rollback_reason":"no improvement; webpack's default validation is already fast with filesystem cache","cold_build_penalty":"88s (full cache rebuild due to config change)"}}
{"run":41,"commit":"ceed1b9","metric":33,"metrics":{},"status":"discard","description":"Verification: 33s. Build varies 31-35s based on system load. All optimization paths exhausted after 40 experiments.","timestamp":1775661926530,"segment":0,"confidence":64,"iterationTokens":11138,"asi":{"hypothesis":"final verification","rollback_reason":"no changes","final_range":"31-35s depending on system load","total_improvement":"95→31s best (67%)","experiments_total":40}}
{"run":42,"commit":"ceed1b9","metric":31,"metrics":{},"status":"discard","description":"esbuild ESM for 17 safe packages (+ tsc emitDeclarationOnly): 31s (same). tsc declarations dominate the per-task time, making the esbuild JS part negligible. Adds complexity for no gain.","timestamp":1775662878004,"segment":0,"confidence":64,"iterationTokens":692,"asi":{"hypothesis":"esbuild for ESM JS + tsc for declarations would speed up the 17 non-critical packages, freeing CPU","rollback_reason":"no improvement. tsc --emitDeclarationOnly still takes ~80% of full tsc time (parse+bind+emit), so the esbuild JS speedup is lost","safe_packages":17,"unsafe_packages":"7 (5 translators + 2 type-only re-exports)","key_learning":"tsc declaration generation requires full program parse/bind, which is the bulk of the work. Only the final JS emit is fast — skipping it saves only ~20%"}}
{"run":43,"commit":"ceed1b9","metric":32,"metrics":{},"status":"discard","description":"esbuild ESM (JS-only) + separate types for 17 safe packages: 32-34s (no improvement over 31s best). 17 extra type-generation processes offset the per-task ESM speedup.","timestamp":1775663132248,"segment":0,"confidence":64,"iterationTokens":487,"asi":{"hypothesis":"instant ESM builds for 17 packages unblock critical path faster; types run off-path","rollback_reason":"17 additional tsc processes for declarations offset the time saved by instant ESM tasks. Net effect is within noise (32-34 vs 31-33)","key_learning":"process count is a hard ceiling. Each new wireit task adds ~0.5s overhead regardless of task duration. The only way to improve is to REDUCE total task count, not add more tasks"}}
{"run":44,"commit":"ceed1b9","metric":37,"metrics":{},"status":"discard","description":"Combine CJS+ESM into single wireit task (62→38 tasks): 37s warm (vs 31s). WORSE — serializing CJS before ESM + 3× more output hashing outweighs the task count reduction.","timestamp":1775663492464,"segment":0,"confidence":64,"iterationTokens":690,"asi":{"hypothesis":"reducing task count from 62 to 38 would reduce wireit orchestration overhead","rollback_reason":"3 problems: (1) CJS runs before ESM (serialization), (2) wireit hashes 3 output dirs per task instead of 1, (3) parallel CJS+ESM was more efficient. product-editor: 5.6s combined vs 4.2s parallel","key_learning":"CJS and ESM running as separate parallel tasks is BETTER than combining. The parallelism saves more time than the wireit overhead it costs. Do NOT reduce task count by combining parallel tasks."}}
{"run":45,"commit":"ceed1b9","metric":33,"metrics":{},"status":"discard","description":"Exclude e2e-utils-playwright and integrate-plugin from build: 33s warm (vs 31s). Filter resolution overhead outweighs saving 4 tasks. Cold build much worse (81s).","timestamp":1775663666367,"segment":0,"confidence":64,"iterationTokens":512,"asi":{"hypothesis":"skipping 2 unused packages reduces 4 tasks","rollback_reason":"pnpm --filter adds resolution overhead that offsets the savings. Cold build severely worse (81s vs 47s)","key_learning":"pnpm filter resolution is expensive. For small task savings, it's not worth adding filter flags."}}
{"run":46,"commit":"ceed1b9","metric":33,"metrics":{},"status":"discard","description":"Remove build tasks from 2 unused packages (e2e-utils-playwright, integrate-plugin): 33-34s (no improvement). 4 fewer tasks out of 62 is insufficient to change wall-clock time.","timestamp":1775663870211,"segment":0,"confidence":64,"iterationTokens":489,"asi":{"hypothesis":"removing 4 unused build tasks reduces total work","rollback_reason":"the 2 packages ran in parallel with everything else and took only 2.5s each. Removing them doesn't free the critical path","tasks_removed":4,"tasks_total":62}}
{"run":47,"commit":"ceed1b9","metric":33,"metrics":{},"status":"discard","description":"Final verification after 46 experiments: 33s (within 31-35 range). All viable optimization paths explored and exhausted.","timestamp":1775664287232,"segment":0,"confidence":64,"iterationTokens":9551,"asi":{"hypothesis":"final state verification","rollback_reason":"no changes","session_summary":"Session 4: tried esbuild ESM for 17 packages (same perf, tsc declarations dominate), combined CJS+ESM tasks (worse, lost parallelism), excluded unused packages (marginal), webpack snapshot timestamps (no change). All incremental approaches exhausted.","total_experiments":46,"final_range":"31-35s","improvement":"95→31s (67%)"}}
{"run":48,"commit":"ceed1b9","metric":32,"metrics":{},"status":"discard","description":"Reduce admin/blocks webpack dependencyOutputs from 111 to 47 entries: 32-33s (within noise of 31s best). Marginal improvement not worth the risk of stale dependency tracking.","timestamp":1775664637302,"segment":0,"confidence":64,"iterationTokens":484,"asi":{"hypothesis":"reducing wireit fingerprint scope speeds up dependency checking before webpack starts","rollback_reason":"within noise range (32-33 vs 31-35). Removing build-style and build-types from deps could cause stale builds if those artifacts change without build-module changing","entries_removed":64}}
{"run":49,"commit":"ceed1b9","metric":32,"metrics":{},"status":"discard","description":"Session 5 verification: 32-33s warm. Profiled tsc emit phase — components: 3.01s emit out of 4.29s total (70%). This is pure TypeScript compiler emit speed, irreducible without swc/esbuild. 49 experiments across 5 sessions, final range 31-35s.","timestamp":1775664947455,"segment":0,"confidence":64,"iterationTokens":485,"asi":{"hypothesis":"verification after tsc emit profiling","rollback_reason":"no changes","profiling_results":{"components_emit_s":3.01,"components_total_s":4.29,"product_editor_emit_s":2.1,"product_editor_total_s":3.24},"key_finding":"tsc emit phase (AST→JS/DTS generation) is 65-70% of build time per package. This is the irreducible floor for TypeScript compiler.","session_experiments":"48-49"}}
{"run":50,"commit":"ceed1b9","metric":0,"metrics":{},"status":"crash","description":"Admin webpack resolve from src/ instead of build-module/: FAILS. babel-loader can't handle type-only re-exports in source (same root cause as esbuild ESM). Would need isolatedModules/export type in source.","timestamp":1775665279929,"segment":0,"confidence":64,"iterationTokens":12149,"asi":{"hypothesis":"resolving WC packages from src/ lets webpack start without waiting for tsc builds","rollback_reason":"babel-loader (like esbuild) processes files individually and can't distinguish type-only exports from value exports. components/src/index.ts exports MediaUploaderErrorCallback (type-only) which babel keeps, causing webpack 'not found' error","key_learning":"ANY approach that bypasses tsc for the source code is blocked by the same issue: non-isolatedModules-compatible type exports. This includes: esbuild ESM, babel-loader from src, swc, etc. The ONLY tool that handles this correctly is tsc.","dead_end":"resolving from source is blocked for all packages with type-only re-exports (components, data, onboarding, sanitize at minimum)"}}
{"run":51,"commit":"ceed1b9","metric":34,"metrics":{},"status":"discard","description":"Verification: 33-34s warm (within 31-35 range). 50 experiments complete. The isolatedModules blocker is the definitive wall — no alternative transpiler can replace tsc for ESM builds.","timestamp":1775665431391,"segment":0,"confidence":64,"iterationTokens":488,"asi":{"hypothesis":"verification","rollback_reason":"no changes","total_experiments":50,"definitive_conclusion":"The only way below 31s requires either: (1) adding swc/esbuild-loader as new dep, (2) making source code isolatedModules-compatible with export type, or (3) replacing tsc entirely. All blocked by constraints."}}
{"run":52,"commit":"ceed1b9","metric":32,"metrics":{},"status":"discard","description":"WIREIT_PARALLEL=infinity + WIREIT_LOGGER=quiet-ci: 32-33s (within noise). Wireit parallelism was already sufficient; quiet logger saves negligible output formatting.","timestamp":1775665705318,"segment":0,"confidence":64,"iterationTokens":485,"asi":{"hypothesis":"removing wireit's internal parallelism cap and reducing logger overhead","rollback_reason":"within noise (32-33 vs 31-35). WIREIT_PARALLEL default is cpus*2=28 which was already enough for 62 tasks on 14 cores","wireit_default_parallel":28}}
{"run":53,"commit":"ceed1b9","metric":33,"metrics":{},"status":"discard","description":"WIREIT_MAX_OPEN_FILES=4096: 33-35s (within noise). File descriptor budget wasn't a bottleneck — wireit's concurrent file reads don't hit the 200 limit.","timestamp":1775666273090,"segment":0,"confidence":42.666666666666664,"iterationTokens":488,"asi":{"hypothesis":"increasing wireit file descriptor budget from 200 to 4096 would reduce serialized file I/O","rollback_reason":"within noise. File reads are fast on SSD and wireit doesn't have 200 concurrent opens in practice"}}
{"run":54,"commit":"ceed1b9","metric":32,"metrics":{},"status":"discard","description":"Final verification session 7: 32s. 53 experiments complete. Optimization is definitively at the architectural floor.","timestamp":1775666425779,"segment":0,"confidence":32,"iterationTokens":508,"asi":{"hypothesis":"final verification","rollback_reason":"no changes","session7_tried":"WIREIT_PARALLEL=infinity, WIREIT_LOGGER=quiet-ci, WIREIT_MAX_OPEN_FILES=4096, admin webpack resolve from src/ (crashed: isolatedModules blocker)","total_experiments":53,"final_result":"95→31s (67%), 6 kept optimizations"}}
{"run":55,"commit":"ceed1b9","metric":32,"metrics":{},"status":"discard","description":"Session 8 baseline: 32s warm. Stable in 31-35 range.","timestamp":1775666534022,"segment":0,"confidence":32,"iterationTokens":3072,"asi":{"hypothesis":"baseline verification","rollback_reason":"no changes"}}
{"run":56,"commit":"ceed1b9","metric":33,"metrics":{},"status":"discard","description":"Session 8: investigated esbuild Node API (fast enough as CLI), package webpack cache staleness (normal 370-540ms), fs-extra load time (16ms, negligible). No new optimization found. 55 experiments total, 95→31s (67%).","timestamp":1775666750196,"segment":0,"confidence":32,"iterationTokens":5334,"asi":{"hypothesis":"session 8 exploration","rollback_reason":"no viable optimization found","investigated":["esbuild Node API vs CLI (negligible difference)","package webpack compile times (370-540ms is normal cached)","fs-extra load in admin webpack config (16ms)","WIREIT_MAX_OPEN_FILES/PARALLEL/LOGGER (no effect)"],"conclusion":"optimization is complete at 95→31s (67%). The floor is proven across 55 experiments."}}
